Cynthia applied sunscreen while Tanya did not. _ has naturally dark skin that resists burns.	Cynthia	Tanya	Tanya	agree	If X has dark skin but Y does not, Y will use sunscreen while X will not
Victoria bought some perfume for Monica's oldest daughter but _ worked for a fragrance company.	Victoria	Monica	Monica	agree	If it's notable that X did something for Y, it was unusual.
The pineapple dish was served to Justin by Steven since _ disliked pineapple but could bake well.	Justin	Steven	Steven	agree	If X doesn't like something but can bake it then X would serve it to Y who likes it.
Jesse bought a waistcoat and boots so he could dress like a pirate for Halloween. The buckles on the _ came undone and tripped him.	waistcoat	boots	boots	agree	If X comes undone, it can be more hazardous for someone walking than if Y does.
Gem needed to heal her broken heart so she bought both ice cream and chocolate. She chose to eat the _ first because she was cold.	ice cream	chocolate	chocolate	agree	If she is cold, she will choose to eat Y before X.
Eric wanted to sell the car but Craig did not. _ decided he could deal with getting rid of the car sooner..	Eric	Craig	Craig	agree	If X is against the sale  Y wants then Y might change the mind of X.
So _ was working at home because Hunter has a lot of free time and Joel is busy.	Hunter	Joel	Joel	agree	If Y needs to do some work while x is not, then Y can stay at home with X
Matthew went out on a first date, while Joseph stayed home with their spouse, because _ was single.	Matthew	Joseph	Joseph	disagree	If X is going on a first date they aren't married like Y is.
Jessica wanted Kayla to attend the birth of her child but she had other plans. _ was happy that she couldn't make it.	Jessica	Kayla	Kayla	agree	If X hoped Y could attend the birth, Y would be the one who might be happy to avoid it.
Jim bought the phone instead of the monitor at the electronic store because the _ he had last was still working.	phone	monitor	monitor	agree	If X is still working, then someone will buy Y instead of X.
Lawrence was trying to spray Hunter with the hose while they were washing the car but _ was the one who got in trouble by their parents.	Lawrence	Hunter	Hunter	agree	If X got in trouble instead of Y then this is worth mentioning.
At the party, William was drinking heavily and Joseph was abstaining, so _ rode home afterwards.	William	Joseph	William	agree	If X is drinking and Y isn't, then X would ride and Y would drive.
The baby had sensitive skin, so it needed to be washed with unscented soap and shampoo. The _ cleaned its body.	soap	shampoo	soap	agree	If X washes hair and Y washed bodies, then Y would be used to clean the babies body.
Steven made sure to eat dinner, but Derrick didn't have time, so as a result _ got drunk at the party.	Steven	Derrick	Steven	disagree	If X eats but Y doesn't, Y is more likely than X to get drunk
