His parents hated that Ben loved cakes and apples. He decided to cut the _ from his diet to be unhealthy.	cakes	apples	apples	agree	If X is healthy and Y is not, then to be unhealthy a person will not eat X and instead eat Y.
The doctor put on plastic gloves to put the tube into the patient's stomach, so that the _ could be thrown away later.	tube	gloves	gloves	agree	If X is needed to insert Y, then X can be thrown out after it is used.
Ryan offered condolences to Joseph although _ was more upset about the death of their friend.	Ryan	Joseph	Ryan	agree	If X is more upset than Y then Y should offer condolences to X.
Donald wanted to take a nap but Nelson didn't so _ had to go to bed because they are nice.	Donald	Nelson	Nelson	agree	If X wanted to take a nap and Y didn't, and Y took a nap, it's because they are nice.
Craig needed to leave in an hour to be on time, but Justin hadn't even woken up yet. _ hurried so they would make it.	Craig	Justin	Justin	agree	If X awoke later he needed to get ready quickly to catch up in time.
Derrick loved the feel of sand between their toes but Hunter didn't. _ took their shirt off at the beach.	Derrick	Hunter	Hunter	disagree	If X loves the beach more than Y does then X would take their shirt off at the beach and not Y.
Jill wanted to use less plastic by switching to paper or canvas grocery bags.  She went with the _ because they could be recycled easily.	paper	canvas	paper	agree	If X can be recycled easier than Y, then X will be chosen
Nick was helping Jeffrey from trying to smoke cigarettes because _ now smokes two packs a day.	Nick	Jeffrey	Jeffrey	agree	If X smokes a lot and Y is a friend then Y will help X stop.
Because Derrick paid for an expensive dinner for Justin on their date that did not go well, _ felt guilty.	Derrick	Justin	Justin	agree	If X paid for an expensive dinner with Y that did not go well, then Y will feel guilty.
Logan had more bites than Samuel had because _ had fallen asleep in the house.	Logan	Samuel	Samuel	agree	If X didn't fall asleep in the house like Y, then X would have more bites than Y.
Throughout his years the child loved his blanket and not his teddy because the _ was older.	blanket	teddy	blanket	agree	If X is older than Y then a person would prefer X over Y.
Lindsey wanted to ask Sarah out on a date, but _ was too unpopular to make an approach toward them.	Lindsey	Sarah	Lindsey	agree	If X is unpopular, X won't ask Y on a date
The kids wanted to go diving and swimming in the hotel pool. However, their parents said the pool was too deep for _ .	diving	swimming	swimming	agree	If the pool is too deep, Y is not possible, but X is.
Amy was scolded by Natalie for not emptying the litter box although it was _ 's turn to do the chore.	Amy	Natalie	Natalie	agree	If it's X's turn and they complained that Y didn't do it, it's notable.
Neil used Kenneth's iron to press their pants, because _ told them that it was harder to hang them.	Neil	Kenneth	Kenneth	agree	If X had less experience with pressing pants he listened to Y's advice.
Rebecca allowed Erin to put something different on, because _ preferred more simple music.	Rebecca	Erin	Erin	agree	If Y prefers more simple music, then X will allow Y to put on something different.
Nelson has some very red eyes, but Robert does not because _ lives in a dry climate.	Nelson	Robert	Nelson	agree	If X has dry air around them their eyes will be more irritated that Y's will be.
Samantha was a minority but Carrie was not. _ was a victim of affirmative action when applying for a job.	Samantha	Carrie	Carrie	agree	If X is a minority and Y is not, then Y will be a victim of affirmative action when applying for a job.
Samantha stopped smoking for the sake of Maria, because _ wanted them to stop worrying.	Samantha	Maria	Samantha	agree	If X changes for Y then they care for Y.
Lindsey saved a lot for retirement, while Natalie did not save at all. _ missed out on a lot of fun activities while growing up.	Lindsey	Natalie	Lindsey	agree	If X saves money, they spend less on whimsical activities than Y does.
Kevin asked Brian to help milk the cows on the farm because _ was bored.	Kevin	Brian	Brian	agree	If X is bored, Y will ask X to do something
Josh wanted to get rid of his wrinkles and dark circles under his eyes, and he felt the _ could be helped by getting more surgery.	dark circles	wrinkles	wrinkles	agree	If someone has X then a more drastic step is needed than would be required for Y.
Elena trusted Natalie with all of their secrets, but _ didn't realize they were a gossip.	Elena	Natalie	Elena	agree	If X knew about the flaws of Y they would maintain silence.
It was equally important to have a good progress reports as it was to have good grades because the _ was telling of comprehension.	reports	grades	grades	agree	If someone gets good X it's better to reflect their understanding than only getting a good Y.
His parents hated that Ben loved cakes and apples. He decided to cut the _ from his diet to be healthy.	cakes	apples	cakes	agree	If X is healthy and Y is not, if Ben wants to be healthy, he should cut out Y.
Sam wanted to buy a motorcycle but his mom said a car would be safe. The _ would be quicker for getting to work in traffic.	motorcycle	car	motorcycle	agree	If X is smaller than Y, then X would be quicker for getting to a destination in traffic.
I wanted to paint the garage, but decided it made more sense to paint the house, as the _ was not looking fresh from last year's coating.	garage	house	house	agree	If X isn't looking attractive it needs sprucing up more than Y.
It was a busy time where Hunter worked while relaxed at Matthew's job because it was February and _ was a landscaper.	Hunter	Matthew	Matthew	agree	If X is a seasonal worker in off season at Y's job then they have a slow period.
Amy made Patricia go to the outdoors to camp with her because _ is her guardian.	Amy	Patricia	Patricia	agree	If X is Y's guardian, X can make Y go somewhere
James wanted be on time to dinner with his date but the _ is cold.	dinner	date	dinner	agree	If X has time to get cold it could be that Y is late.
William wanted to turn the heater up while Hunter wanted to turn it down because _ was feeling hot.	William	Hunter	Hunter	agree	If X is feeling hotter than Y, then X would want the heat lower than Y would.
The oatmeal bath was recommended to Maria but not Rebecca since _ had strep throat.	Maria	Rebecca	Rebecca	agree	If X has strep throat, and an oatmeal bath doesn't help step throat, X shouldn't take an oatmeal bath.
She found it was much easier to drive with window down and the radio on.  The _ needed to be turned down.	window	radio	radio	disagree	If X is down you really need to turn Y up.
Monica hated the flatness of the mid-west, Felicia did not therefore _ wanted to transfer to Utah.	Monica	Felicia	Monica	agree	If X hated flatness then X would like the mountains and valleys in Utah better than Y.
Matthew didn't want to clean up the kitten's dirty litter box for Justin so _ insisted on payment.	Matthew	Justin	Matthew	agree	If X doesn't want to clean it for Y, then X will ask for payment to do it.
Emily takes prescription medicine for their pain but Cynthia only uses essential oil as _ does not have issues with addiction.	Emily	Cynthia	Emily	agree	If X is addicted they can't use the same strong prescription medications as Y because they will not be able to control the desire to want more of the medicine.
James asked for a bag if they are paying him in cash and not a check because the _ is bulky.	cash	check	cash	agree	If X is bulky and Y isn't then a person needs a bag to carry X.
Rachel knew Elena needed more magnesium but _ didn't know if they liked fruit or not.	Rachel	Elena	Elena	disagree	If X wants to give more magnesium to Y it would be hard if X doesn't know if Y likes fruit or not.
After Logan contracted the chickenpox from Joseph so _ spent the day sending mean texts about it.	Logan	Joseph	Logan	agree	If X gets an infectious disease from Y, X will be upset at Y
On his way to the interview, Max bought a nice tie to go along with his slacks, but he spilled food on his chest, causing the _ to get dirty.	tie	slacks	tie	agree	If X is spilled on Y then anything on Y gets dirty.
Elena dyed Katrina's hair in a bright red and green colour, because _ is extravagant.	Elena	Katrina	Katrina	agree	If X has bright hair and Y doesn't then X is considered more extravagant.
Jim preferred using the weights for exercise instead of the machines because the _ were not being used.	weights	machines	weights	agree	If no one is using X, then people will choose X rather than waiting for Y.
At the women's aisle, Ursula ponders whether she should buy pads or tampons, and eventually picks the _ because they're less conspicuous.	tampons	pads	tampons	agree	If X is less conspicuous, then a woman will choose X instead of Y.
Ian's dog looks better groomed than Eric's because _ did it at their own home.	Ian	Eric	Eric	agree	If X groomed their own dog, and Y went to a groomer, Y's dog would look better.
Dennis robbed Matthew of his jewelry because _ didn't really have many worldly possessions to begin with.	Dennis	Matthew	Dennis	agree	If X doesn't have something and Y does then X would steal from Y.
Jen tried to get rid of her baby's cradle cap with dandruff shampoo and a soft brush, and the _ helped heal the dry skin.	brush	shampoo	shampoo	agree	If X helps with irritation better than Y, then X will heal the irritation.
Benjamin looked at how successful Brian was in business and felt jealous, because _ was poorer at first.	Benjamin	Brian	Brian	agree	If Y was poorer at first, then X will feel jealous if Y becomes successful.
Amy wanted a soft toothbrush but Mary wanted a firm one because _ was concerned about soreness.	Amy	Mary	Amy	agree	If X wanted no irritation they'll opt for pliancy in a head, more so than Y who isn't pickly.
Robert has many tattoos on his body, while Aaron has none, because _ is an atheist.	Robert	Aaron	Robert	agree	If X is an Atheist, and Y is not, then X will have tattoos, while Y does not.
Emily asked her sister Sarah if she needed any tampons or pads from the store, even though _ didn't because she had switched to using menstrual cups.	Emily	Sarah	Emily	agree	If X had the supplies that X needed then Y does not need to buy tampons or pads.
Stan had to choose between a glass or plastic tank to house his crickets, and he chose the _ because it was less scratchable.	plastic	glass	glass	agree	If Y is less scratchable, then Y will be choses instead of X.
He decided do buy the wool jacket instead of the linen one, because the _  jacket is better for the summer.	wool	linen	linen	agree	If Y is better for the summer, then he will choose to buy X instead of Y.
Derrick always lost the key to his car when at home unlike Hunter, due to _ being unforgetful.	Derrick	Hunter	Hunter	agree	If X is forgetful but Y is not, X will lose things while Y will not
Monica was so much older than Jessica which is why the sorcerer Daniel gave _ the fountain of youth to grant their fondest wish.	Monica	Jessica	Monica	agree	If X is more aged, they will want to do something to be more like Y.
The salesman had various products to sell and sold a lot of desks but not chairs because the _ were cheap.	desks	chairs	chairs	disagree	If X is cheaper than Y, people will buy more of X.
Dennis surprised Steven with a watermelon as a snack because _ knew he loved them.	Dennis	Steven	Dennis	agree	If X knows Y loves watermelon X would offer it as a snack.
Before they died, Ryan prepared a will however Christopher did not, so _ 's estate was distributed to the beneficiaries the state determined it would be.	Ryan	Christopher	Christopher	agree	If X has a will but Y does not, Y's estate will be distributed by the state
Arya had a tough head so she chose to wear the weave instead of the wig. The _ is painful.	weave	wig	weave	agree	If X is painful, then a tough person will choose X instead of Y.
The dog ran up to Leslie and away from Lawrence because _ had soap for the dog to take a bath.	Leslie	Lawrence	Lawrence	agree	If Y has soap for a bath, then a dog will run to X and away from Y.
A nervous Monica looked up at Mary near the top of the ladder , as _ held it.	Monica	Mary	Monica	agree	If X was holding it, Y had to be on it.
The thermostat showed that it was twenty degrees cooler downstairs than it was upstairs, so Byron stayed in the _ because he was hot.	downstairs	upstairs	downstairs	agree	If Byron is hot, and X is cooler than Y, Byron would want to be at X.
The grey moon showed itself above in the sky as I watched the cars go by with passion. Then the _ brightened.	moon	sky	moon	disagree	If X appears it will cause Y to become more light.
Jim was happy to trade my desk for his computer . He thinks the _ will work great.	desk	computer	desk	agree	If X will work great, then Y will be traded for X.
Christopher had a private jet and was able to travel in style, while Benjamin had to fly coach, because _ was poor.	Christopher	Benjamin	Christopher	agree	If X has a private jet, and Y has to fly coach, then Y is poor.
Brett thought it would be romantic to go on a picnic but Jason thought there were too many bugs. _ suggested they take bug spray.	Brett	Jason	Brett	agree	If X didn't care about bugs, but Y did, X would tell Y to bring bug spray.
Carrie wanted Sarah to get a new phone for _ believed anything not the latest update acceptable.	Carrie	Sarah	Sarah	agree	If X liked anything not the latest update then Y should conform to what X thinks.
Jeffrey did not trust Samuel at all, even though _ was the real pickpocket .	Jeffrey	Samuel	Jeffrey	agree	If X will steal and Y doesn't then X should be trusted less.
When Kevin threw his beer at the man, Brian yelled, so the officer gave _ a whimsical glare.	Kevin	Brian	Brian	agree	If X throws a beer, and Y yells, then Y will get a glare.
The film was only playing during the weekday or over the weekend. We went on the _ even though everyone was off work and it was more crowded.	weekday	weekend	weekend	agree	If people work during X they go more frequently during Y.
James needed to walk closer to the pond to get the fishing rod into it. The _ is small.	pond	rod	rod	agree	If X must be moved closer, Y is bigger.
As the boss, Rachel asked Cynthia nicely to do more work so _ could go home earlier.	Rachel	Cynthia	Rachel	agree	If X is the boss, then X will ask Y to do more work, so X can go home early.
We cleaned up litter from older and juvenile, we mostly found the _ people littered because of the soda cans.	older	juvenile	juvenile	agree	If X drinks more of a certain fluid than Y then they are most likely littering the cans of that fluid.
Kyle was wearing a sweatshirt while Aaron was in a tank top because _ thought the temperature outside was far too warm.	Kyle	Aaron	Aaron	agree	If X is wearing a sweatshirt while Y is wearing a tanktop, Y believes the weather is warm
The child was screaming after the baby bottle and toy fell. Since the child was hungry, the _ stopped his crying.	baby bottle	toy	baby bottle	agree	If X is offered to a hungry tot they will prefer this and be satisfied more than if they are given Y.
I can't concentrate in silence so I'd rather go to the cafe instead of the library to study since the _ is not quiet.	cafe	library	cafe	agree	If you want to hear more sounds, go to an X, not a Y.
Kenneth was showing Nick how to sew up a hole in his shirt but accidentally stabbed himself with the needle, so _ cried out in pain.	Kenneth	Nick	Kenneth	agree	If X gets hurt and Y doesn't then X will shout in pain.
Sara thought she might have a problem with coffee but was fine with alcohol because the _ was nasty.	coffee	alcohol	alcohol	disagree	If X is nasty, the there might be a problem with X, while Y is fine.
Jen used a glove and a rebreather to clean up mold, she was counting on the _ to avoid a cough.	rebreather	glove	rebreather	agree	If X will protect getting a cough and Y doesn't then a person will wear X and not Y.
Eric was told to drop Justin at school since it was where _ went to work.	Eric	Justin	Justin	agree	If X works somewhere, then Y will drop X off there.
John's emotions were a lot worse than Sam's feelings because the _ of Sam were uncontrollable.	emotions	feelings	feelings	agree	If X is manageable they are less worse than would be Y.
Because Sarah missed their night flight while Christine made theirs, _ slept on the plane.	Sarah	Christine	Christine	agree	If X is going to sleep on the plane X has to make the plane.
The smell of mold when we entered the house was strong so we opened the windows and lit some candles, but the _ didn't help without a breeze.	windows	candle	windows	agree	If X is used in an enclosed place the mold smell remains without it being moved out by Y.
In class today, Tanya asked Samantha about the circuits they were learning about, because _ paid attention to what the instructor told them.	Tanya	Samantha	Samantha	agree	If X pays attention to an instructor, Y will ask X questions about what is being learned.
Because Lindsey wanted to make a mess and Victoria did not, _ cracked her eggs and opened them over the counter.	Lindsey	Victoria	Lindsey	agree	If X wants order they will avoid disorder while Y will create it.
Kenneth couldn't find a clean pair of underwear, so he took one from Joseph, so _ wasn't able to find theirs on time.	Kenneth	Joseph	Joseph	agree	If X borrows something from Y then Y won't have any to use.
Michael's hygiene isn't nearly as good as Joel's due to _ showering once a day.	Michael	Joel	Joel	agree	If X bathes regularly, their hygiene is better than Y's.
Laura found a book and a magazine on the table, and she decided to take the _ because she was going to the beach for a long time.	book	magazine	book	agree	If X is longer than Y, then X will be chosen to take for a longer time.
Justin received a diagnosis of borderline personality disorder (BPD) from his doctor, Aaron worried about him. But _ did not behave differently in front of him.	Justin	Aaron	Aaron	disagree	If X had a disorder the Y might want to observe them and note if their behavior was different.
The hair cream was able to work with her dry, thick hair because the _ was thick.	cream	hair	cream	agree	If someone has lustrous Y using X is better on it.
Betty fasted during the month of Ramadan, but Victoria maintained a normal diet, because _ was a practising Hindu.	Betty	Victoria	Victoria	disagree	If X fasted during the month of Ramadan, and Y maintained a normal diet, then X is a practicing Hindu.
Samantha was a minority but Carrie was not. _ was a recipient of affirmative action when applying for a job.	Samantha	Carrie	Samantha	agree	If X is a minority and Y is not, then X will receive affirmative action when applying for a job.
Donald wanted to take a nap but Nelson didn't so _ had to stay up because they are nice.	Donald	Nelson	Donald	agree	If X wanted to nap, but they stayed up with Y, X was being nice.
The mother purchased only diapers but no wipes this week, since she had too few the _ at home.	diapers	wipes	diapers	agree	If someone is out of X but not Y they will buy more of X.
Megan got a big kiss of thanks from Mary, because _ had received some flowers.	Megan	Mary	Mary	agree	If X gives something to Y, Y will thank X
The ability to finish what you start is what you need to improve, said Michael to Brian,  _ sometimes has to be the one who takes charge.	Michael	Brian	Michael	agree	If X knows better than Y how to finish what is started then X would take charge.
Brett knew a little about dryers and tried to fix  dryer while Craig was very good at fixing them. _ wouldn't fix the dryer.	Brett	Craig	Craig	disagree	If X knew a little about fixing the dryer but Y knew more then Y would fix it.
Rachel was the designated understudy when Victoria lost their voice due to laryngitis, so _ had to accept the soprano position.	Rachel	Victoria	Victoria	disagree	If X is the understudy, when Y loses their voice, the X will have to accept the position.
The chef took the peas out of the steamer and put in the carrots because the _ were still raw.	peas	carrots	carrots	agree	If X isn't as well cooked as Y then you should cook X longer.
The brown leather glove was loose on her hand because the _ was too big.	glove	hand	glove	agree	If X is too big for Y, then X will be loose
The couple couldn't decide whether to get a new refrigerator or new laundry machine. They went with the latter because their old _ was dilapidated.	refrigerator	laundry machine	laundry machine	agree	If X is in worse condition than Y, then X should be replaced first.
The burglar was able to sneak past the cameras easier than the alarms, since the _ were inferior quality.	cameras	alarms	cameras	agree	If X is more faulty than Y then X is easier to sneak past.
Just a moment ago, Jennifer sat on Natalie's lap, but it was very uncomfortable. _ is small.	Jennifer	Natalie	Natalie	agree	If X is smaller than Y, it will be uncomfortable to have Y sit on X
The staff the man bought made out of plastic was actually nicer than the wood one because the _ one was an antique.	plastic	wood	plastic	agree	If X is an older material it is better than Y.
Mary's apartment had a door in front and a kitchen window in back. When a fire broke out in the entryway, Mary escaped through the _ .	door	window	window	agree	If X is blocked but Y is not, Y will be used for escaping
They had invested in a large curtain that would drop onto the stage, but it didn’t work out because the _ was too short.	curtain	stage	curtain	agree	If X is too short to be useful, then using X won't work.
After eating pizza and wine found strange stains on my dress. They were orange so it must have been the _ .	wine	pizza	pizza	agree	If X leaves orange stains and Y doesn't then X would have left the orange marks.
So _ threw the yarn at the cat because Michael knew it wanted to play, while Neil just watched on.	Michael	Neil	Michael	agree	If X knew the cat wanted to play, and Y didn't, then X is more likely to start playing with the cat.
All the players involved in playing cards had only two decks. The _ were not enough.	Cards	Decks	Decks	agree	If more X is needed than Y, then people can't play if they don't have enough X.
We ordered a Hawaiian pizza with pineapple and ham. Jim picked off all of the _ because he is a vegetarian.	ham	pineapple	ham	agree	If X is a meat it can't be eaten by someone who is a vegetarian but Y could be.
The floor was much more slippery than the carpet because the _ had less friction.	carpet	floor	floor	agree	If X isn't soft it has Y.
The tire on the car lasted a longer time than the one on the bike because the man never drove the _ .	car	bike	car	agree	If X is used more than Y, then Y will last longer.
Gmail is so yesterday Samantha thought as Jennifer talked about it, _ is on top of new trends.	Samantha	Jennifer	Samantha	agree	If X is more knowledgeable and knows the trend, then X will know what Y is talking about.
The groundskeeper replaced the filter in the pond. He could see that the _ was full.	pond	filter	filter	agree	If Y is full, then the Y in X needs to be replaced.
Jessica often takes care of Natalie when they are sick and _ often feels resentful.	Jessica	Natalie	Jessica	agree	If X is always taking care of Y, X becomes resentful of Y.
David was a teenager who had just gotten his first car which had nice leather seatsr, David was careless driving and damaged the _ .	car	seats	car	agree	If someone were not cautious they might damage X but less likely they would damage Y.
Felicia likes the air conditioning setting much lower than Christine because _ is always freezing.	Felicia	Christine	Christine	agree	If X is freezing but Y is not, Y will set the air conditioning lower than X would.
The box was still visible after James tried his best to manage the wrapper on it. James should have used the _ that is small.	wrapper	box	box	agree	If X is small then Y won't be able to cover X easily.
I lost weight and used an electronic scale instead of my old mechanical one. The _ one was time gaining.	mechanical	electronic	electronic	agree	If X is more time consuming than Y then somebody would pick Y over X.
She took the hose out to the yard to water the pot of flowers weekly, nevertheless the _  flourished.	flowers	yard	yard	agree	If you take the hose from Y to water X, it doesn't mean Y won't flourish.
The clothes of Kenneth always smell, but Ian's smell very good. _ does laundry once a month.	Kenneth	Ian	Kenneth	agree	If X does cleans something less often than Y, then X will smell worse.
Gem went to get new supplies for her hamster and she found snacks and exercise balls She chose the _ because her hamster was skinny.	exercise balls	snacks	snacks	agree	If X were given to a skinny hamster it would help fatten it while Y would just make it more skinny.
It's better to sleep on flannel sheets than silk sheets in the winter. The _ keeps you cooler.	flannel	silk	silk	agree	If X feels slicker it will keep you cooler than Y.
The boy wore jeans instead of shorts because the _ would keep him feeling cool in the cold.	jeans	shorts	shorts	agree	If you wore X instead of Y you'll avoid being hot in heat.
Lindsey gave the container of sugar to Megan because _ had been on a diet.	Lindsey	Megan	Lindsey	agree	If  X is on a diet they want to give away sugar to Y.
A goldfish was a boring pet for Matthew but Samuel loved it, as _ wanted limited interaction with a pet.	Matthew	Samuel	Samuel	agree	If X wants little contact, X will love a pet in a bowl more than Y would.
I really need to upgrade my mouse and RAM on my computer. The computer gets too slow with the _ currently in it.	RAM	mouse	RAM	agree	If X causes Y to be slow, X will be replaced
There are ants all over the porch but not on the driveway, so there must be something on the _ they don't like.	driveway	porch	driveway	agree	If ants are all over X but not Y, then the ants don't like something on Y
