Amy's handwriting was meticulous, while Cynthia's handwriting was often sloppy, because _ was careless about their work.	Amy	Cynthia	Amy	disagree	If X has meticulous handwriting and Y has sloppy handwriting, then Y is careless about their work.
The feet of Jennifer stayed drier than the feet of Felicia because _ had worn their rubber boots.	Jennifer	Felicia	Jennifer	agree	If it's wet out, and X has rubber boots, and Y doesn't, X's feet will stay drier.
The girl used her device for longer than she used her phone so the battery on the _ died later.	device	phone	phone	agree	If X is used less it will last longer than Y.
The wood James dropped into the flame burnt much faster than the diaper does because the _ is inflammable.	wood	diaper	diaper	agree	If X is inflammable and Y isn't then X will not burn in a fire.
Robert went to Hunter and asked him to judge leniently just this one time, because _ didn't break the law before.	Robert	Hunter	Robert	agree	If X was the one who needed leniency then X would have to ask Y for help regarding the law.
In order to use the washer and dryer for laundry, Steve separated his laundry into dirty and wet, then he filled the _ with wet laundry.	washer	dryer	dryer	agree	If X is for drying clothes, and Y makes them wet, the wet clothes need to go in X.
The swimmer chose to swim in the pool rather than the lake because the _ was cooler.	lake	pool	lake	agree	If X is not warm, then swimming in Y is preferrable.
Carrie faced the fan away from Angela because _ was getting too warm in the kitchen.	Carrie	Angela	Carrie	agree	If X was in too warm and was in a different room than Y, then X needed to cool themselves.
Needing to repair a window pane and hang a picture, Shane found a hammer and some glue, so he used the _ to repair the window.	hammer	glue	glue	agree	If you need to repair a window, and find X and Y, you will use Y to fix the window.
Matthew went out on a first date, while Joseph stayed home with their spouse, because _ was married.	Matthew	Joseph	Matthew	agree	If X is married and Y isn't then Y would go out on dates.
Bad posture causes the shoulders to round and the hips to arch. The _ do this because the thoracic spine is curved backward.	shoulders	hips	hips	agree	If X arches while the Y moves inward, it's bad.
The meat was falling into the holes of the grill as it seems the _ is too big.	meat	hole	hole	agree	If X is too large Y can't rest upon it.
Jessica called Angela on the phone to comfort them when _ got the bad news.	Jessica	Angela	Angela	agree	If X got bad news, Y might offer support to X.
The ground around Michael's house was solid unlike Aaron's because _ had a month long drought.	Michael	Aaron	Michael	agree	If there was a drought near X's house and not Y's house, then the ground around X's house would be harder.
Leslie loves cooking and eating jackfruit tacos more than Kenneth because _ is a vegetarian.	Leslie	Kenneth	Leslie	agree	If X can't eat meat, they don't like it as much as Y does.
Monica hated the flatness of the mid-west, Felicia did not therefore _ wanted to transfer to Kansas.	Monica	Felicia	Felicia	agree	If X doesn't mind flat terrain, and Y does, X would be more likely to move to the mid-west, which has flat terrain.
Samantha tries to avoid being late for work unlike Emily. _ gets up 15 minutes before they have to leave.	Samantha	Emily	Emily	agree	If Y gets up 15 minutes before they have to leave, then X tries to avoid being late for work unlike Y.
Kevin was a very healthy individual compared to Donald, because _ went the fitness center monthly.	Kevin	Donald	Donald	disagree	If X goes to the fitness center monthly, the X is a very healthy individual compared to Y.
The insurance for the car was more expensive than the insurance for the truck because the _ was older.	truck	car	truck	agree	If X is older than Y, then X would be cheaper to insure than Y.
It was necessary to hit the iron with the sledgehammer after the _ got heated.	iron	sledgehammer	iron	agree	If X is heated, then Y should hit X.
Martha and Mary, who lived far away from each other, sent each other oranges and cherries from their gardens. Because Mary lived in Washington state, she grew the _ .	oranges	cherries	cherries	agree	If a place grows X and not Y then a person will send X somewhere else.
There was more blood in the patient's hand than in their foot because the _ was farther from the ground.	foot	hand	hand	agree	If X is lower down than Y then X had more blood.
The turtle saw a race and a piece of lettuce. He chose the _ because he was full.	race	piece of lettuce	race	agree	If someone is full then they will perfer X over Y since they don't need Y.
Brett bought the airplane tickets for Joel and their family after _ checked their schedule.	Brett	Joel	Joel	agree	If X buys for Y then X must know when Y is available.
Ian liked some girl in high school, but the girl liked Nick, _ felt sorry for him, but that was life.	Ian	Nick	Nick	agree	If X likes a girl, but the girl likes Y, then Y will feel sorry for him.
In the summer it can be tough to maintain the water in the swimming pool. Sometimes the _ gets dirty and needs scrubbing with a brush.	swimming pool	water	swimming pool	agree	If Y is a liquid, X cannot scrub it.
Rachel was always happy for Felicia but _ got bad grades a lot of the time at school.	Rachel	Felicia	Rachel	agree	If X is happy for Y, X can still get bad grades.
The job was found when a friend gave him a phone and a bus pass. The _ was older.	phone	pass	phone	agree	If X is given to someone along with Y, it's more likely to be an older model.
Since Donald told Christopher his illness,  _ has spent more time at home taking care of the kids.	Donald	Christopher	Donald	disagree	If X is more ill than Y, then Y would spend more time at home with the kids.
The team did better running on the track than on the field because the _ had more friction.	track	field	track	agree	If X is more suitable for the sport, then they will do better in X rather than Y.
Donald finds scrubbing the toilet disgusting but Leslie doesn't. _ avoids cleaning the kitchen whenever possible.	Donald	Leslie	Leslie	disagree	If X likes cleaning better than Y, then X is less likely to avoid cleaning.
I like using sea salt instead of table salt as the _ has finer crystals.	sea salt	table salt	table salt	agree	If X has finer crystals than Y, then Y would be preferred.
In the group photo, Kyle was placed in front of the group and Dennis was placed in back, because _ was short.	Kyle	Dennis	Kyle	agree	If X is short and Y is tall X should be in the front of the picture.
When Monica heard about edible glitter, they called up Patricia to see if _ could come over and show it off.	Monica	Patricia	Patricia	agree	If X had just heard about the glitter they'd want to ask someone like Y to show them.
Kim had to pack her bra and coat. Because it was cramped, she packed the _ .	bra	coat	bra	agree	If X takes more room then you would Take Y instead.
The seamstress needed to hem the jeans of Katrina but not Lindsey because _ was very short.	Katrina	Lindsey	Katrina	agree	If X is short they don't need to have their clothes shortened like Y.
Samantha tries to avoid being late for work unlike Emily. _ gets up an hour before they have to leave.	Samantha	Emily	Samantha	agree	If X doesn't like to be late and Y doesn't care, then X will get up early.
When Carrie told Katrina about quitting working for Avon after two weeks, _ started pouting.	Carrie	Katrina	Carrie	agree	If X ended a job, X will pout so Y can see their sadness.
Samuel suffered from constipation but Randy did not, so _ liked to drink a lot of prune juice.	Samuel	Randy	Samuel	agree	If X is constipated but Y is not, X will drink prune juice
The letter was very damaging to the church, after the contents of the _ were spread all over its pages.	letter	church	church	agree	If the contents of Y are spread all over X, then X will damage Y.
The oil made a bigger mess on the floor than on the grass because the _ was porous.	grass	floor	grass	agree	If X is spilled, it's consistency creates more of a mess than Y's does.
Kayla laughs at Natalie's cooking even though _ doesn't know how to use a microwave and nearly set the kitchen on fire.	Kayla	Natalie	Kayla	agree	If X finds what Y does funny but still doesn't understand how to do something it appears comical.
Justin is a vegetarian and Craig is lactose intolerant. _ avoids foods made from animals.	Justin	Craig	Justin	agree	If X is a vegetarian, X will avoid food made from animals
Everyone cringed as the singer used their loudest singing voice into the microphone because the _ was loud.	microphone	voice	microphone	agree	If X is too loud it will startle Y and cause them to cringe.
Maria is a pretty good athlete but Felicia is an elite athlete. _ finished their mile run in 4 minutes.	Maria	Felicia	Felicia	agree	If Y finished their mile run in 4 minutes, then Y is an elite athlete, while X is a pretty good athlete.
Unlike Craig, William avoided getting a cramp during the marathon, because _ stretched inadequately beforehand.	Craig	William	William	agree	If X prepared, they would have less trouble than Y.
The ropes in the gym class didn't reach the mats because the _ were too low.	ropes	mats	mats	agree	If Y is too low then X will not reach Y.
The estate was known to have the biggest bank in the region. The _ was very famous.	Estate	Bank	Bank	agree	If X is famous and Y is not a person would have heard of X over Y.
The young boy needed help hitting the pinata with the stick because the _ was heavy.	pinata	stick	stick	agree	If X is heavy, then the young boy would need help lifting X.
John had to prepare his speech for next week's meeting and he also has to deliver a project in two days. The deadline of the _ was coming sooner.	project	speech	project	agree	If X comes in days and Y comes in weeks, X is first.
The short, weak librarian tried to put the book on the top shelf but the _ was too high.	shelf	book	shelf	agree	If the librarian can't reach X, then she can't put Y onto X.
English is the language that Patricia speaks but not Katrina because _ grew up in Australia.	Patricia	Katrina	Patricia	agree	If  X speaks the native language of the land X is from there, Y is not.
Jennifer offered to teach her friend Natalie how to crochet a scarf for her mother's birthday. _ was proud to see the results of her learning.	Jennifer	Natalie	Natalie	agree	If X knows how to do something and teaches Y, then Y would be proud of learning it.
The tilapia took longer to cook than the shrimp, so the _ burned more badly.	shrimp	tilapia	shrimp	agree	If X takes longer to cook than Y and you cook them both the same length of time, you'll burn Y.
Kevin repaired the wooden furniture for Kyle last week since _ needed an expert carpenter.	Kevin	Kyle	Kevin	disagree	If Y needed an expert carpenter, the X will fix the wooden furniture for Y.
Michael finds it difficult to share his toys with Adam  when they play together because _ has more toys.	Michael	Adam	Adam	agree	If X has less than Y, it makes it harder to divide things with Y.
Unlike Benjamin, Adam drove a hybrid electric vehicle because _ wanted to reduce smog pollution.	Benjamin	Adam	Benjamin	agree	If X takes action to reduce emissions, they want to reduce Air Carbon more than Y.
Bob wanted to add insulation to the wall of his house, but the _ was too thin.	wall	insulation	wall	agree	If X is too then then Y can't be added between X.
Angela was jealous of Victoria's academic achievements even though _ studies to reach such high standards.	Angela	Victoria	Victoria	agree	If Y studies to reach high standard, then X will be jealous of the academic achievements of Y.
Carrie needed to twist backward to talk with Monica because _ was in front of her.	Carrie	Monica	Carrie	agree	If X has to twist backwards to talk to Y, X is in front.
After the interview was over Bill replaced his pant with shorts for the rest of the day, the _ was cold.	pant	shorts	shorts	agree	If X is cold, X will be replaced with Y
Dwight learned that both his radiator and A/C compressor needed repairs, and without the _ working right, the driver will overheat.	radiator	A/C compressor	A/C compressor	agree	If X cools and Y doesn't, to stay cool a person will fix X over Y.
While I was looking north, Craig had walked west for the duel and Brian had walked east. _  was to my left.	Craig	Brian	Craig	agree	If X is to the left they are going west, while Y goes east.
Megan anticipated a delay in her train so she called the brunch to let them know she would be late. Ironically, the _ was late.	train	brunch	brunch	agree	If X is running late and then Y is late too after making calls, that would be ironic.
Katrina was able to remove the mildew from the tub but not Christine because _ used hand soap.	Katrina	Christine	Christine	agree	If Y doesn't use the correct product, then X will be able to do the job compared to Y.
When Matthew learned how to speed read, Brian praised him because _ had a learning disability.	Matthew	Brian	Matthew	agree	If X learns something to overcome their weakness, then Y will praise them for their courage.
Felicia brought Christine sardines to eat on _ lunch break at work and she was disgusted.	Felicia	Christine	Christine	agree	If X brings in something for Y and Y doesn't like it then Y would be disgusted.
Randy avoided the chicken parmesan and a side salad, but Ryan ordered something else, because _ was on a vegetarian diet.	Randy	Ryan	Ryan	agree	If X is a vegetarian and Y isn't, Y would be more likely to order meat.
At the women's aisle, Ursula ponders whether she should buy pads or tampons, and eventually picks the _ because they're less invasive.	tampons	pads	pads	agree	If X is less invasive than Y, then X will be chosen.
Maria was confident about their work but not Megan because _ had hours of experience on the job.	Maria	Megan	Megan	disagree	If X has hours of experience, then X will be confident while Y is not.
Robert threw the dish on the floor and Jeffrey cleaned it up, because _ is a master.	Robert	Jeffrey	Robert	agree	If X is master the Y must serve him.
Jason made it to puberty a few months before Christopher, so _ spoke with a higher voice.	Jason	Christopher	Christopher	agree	If X makes it to puberty before Y, then Y will speak in a higher voice.
The child of Maria had really bad behavior unlike Amy's child, because _ was not very tolerant.	Maria	Amy	Amy	agree	If X is more tolerant than Y, then X's children would act out more than Y's.
The man tried to use the remote to turn on the television but the _ was too far.	remote	television	remote	agree	If X cannot turn on Y, then X is too far away
Strength-training is a good idea for Adam but not Matthew because _ is recovering from an injury.	Adam	Matthew	Matthew	agree	If X is injured, X shouldn't participate in strength-training
Classic game show Aaron invited a people over for dinner including Joseph, _ was not surprised that know one was going to showing up.	Aaron	Joseph	Joseph	agree	If X invited Y over then X would not expect no one to come.
Megan had vodka and Christine did not have any, so _ needed a designated driver for that night.	Megan	Christine	Megan	agree	If X is not sober, Y must drive.
Michael asked Brett for help moving a desk. _ wouldn't have been able to do it by himself either.	Michael	Brett	Brett	agree	If X can't move something alone, X will ask Y for help
Dwight learned that both his radiator and A/C compressor needed repairs, and without the _ working right, the engine will overheat.	radiator	A/C compressor	radiator	agree	If X fails then it takes priority over being repaired, more than Y.
The woman furrowed her eyebrows, because between a bike and car, the _ was going faster.	bike	car	car	disagree	If X should go faster than Y, but Y is going faster than X, they are going to get funny looks.
In the group photo, Kyle was placed in front of the group and Dennis was placed in back, because _ was tall.	Kyle	Dennis	Dennis	agree	If X is taller than Y, X would be further back in the group photo.
Leslie liked to eat oysters from the shell but Christopher did not as _ was fond of soft foods.	Leslie	Christopher	Leslie	agree	If X likes things that are not crunchy they'll like to eat nonfried shellfish more than Y.
All the players involved in playing cards had only two decks. The _ were too few.	Cards	Decks	Cards	agree	If all the players playing X have only two Y, then X is too few.
The woman had thinner lips than cheeks because the doctor injected the _ with botox.	lips	cheeks	cheeks	agree	If X is injected with Botox but Y is not, Y will be thinner than X
Derrick took a small loan from William, so _ made sure to get it back on time.	Derrick	William	William	agree	If X took something from Y, then Y would want to make sure to get it back on time.
Mom was making pancakes for the kids this morning when she realized they were out of syrup.  I ran to the store so they could enjoy the _ .	syrup	pancakes	pancakes	agree	If someone is out of X in order to enjoy Y then they will go get X.
Jason doesn't know how the world works as well as Kevin because _ had a really easy childhood.	Jason	Kevin	Jason	agree	If X doesn't have challenges like Y, then X won't know about how things work.
Christopher's carpet has few stains on it, while Randy's is very dirty. The carpet of _ is 1 year old.	Christopher	Randy	Christopher	agree	If X has worn carpet then it's older than the cleaner carpet of Y.
Jessica was in need of a tissue but not Victoria because _ had a dry nose.	Jessica	Victoria	Victoria	agree	If X has a dry nose but Y doesn't then X needs a tissue.
Adam called Logan at work to warn about the neighbors house being on fire. _ was leaving home after the call.	Adam	Logan	Adam	agree	If X is going somewhere and Y isn't then X will leave home.
Randy put toilet paper back on the roll, while Kevin did not, so _ was annoyed.	Randy	Kevin	Randy	agree	If X doesn't put toilet paper on the roll, Y will be annoyed with X
The hamster left the food unfinished  but finished drinking the water. It is probably because the _ is too little.	food	water	water	agree	If X is finished first, it's smaller than Y.
Mark put the t shirts in the washing machine and the pants in the dryer, because the _ were wet.	t shirts	pants	pants	agree	If Y is wet, then Y will be put in the dryer, while X is put in the washing machine.
Juniper's school put down a patch of artificial grass on the dying lawn. It didn't match because the _ was too green.	grass	lawn	grass	agree	If X and Y are different, X will not match Y
I was using both steel wool and sandpaper to try and remove the rust from the hammer, but the _ was too coarse.	steel wool	sandpaper	sandpaper	agree	If X is too coarse and Y isn't someone won't use X to do a job.
The child was screaming after the baby bottle and toy fell. Since the child was full, the _ stopped his crying.	baby bottle	toy	toy	agree	If Y stopped the crying, then the child will scream when X and Y fall.
Jill sterilized the bottles using the dishwasher instead of the sink because the water got hotter using the _ .	dishwasher	sink	dishwasher	agree	If X gets hotter, it's safer to use  than Y.
Amy is turning fifty tomorrow and Emily is making them a cake, _ is probably wise.	Amy	Emily	Amy	agree	If X is older than Y, then X would be seen as wise.
The woman determined the smell in the kitchen was coming from the potatoes instead of the onions, because the _ were fresh.	Potatoes	Onions	Onions	agree	If X is fresh and Y isn't then Y will smell worse than X.
Racing against the clock, she caught up to her cab, but still missed her train.  The _ had still left too late.	cab	train	cab	agree	If X had left too late, the even if she caught up to X, she will miss Y.
Jessica was hit by a baseball while watching the game with Jennifer. _ screamed because they were in shock at what happened.	Jessica	Jennifer	Jennifer	disagree	If X were struck X would scream more than Y.
Because Sarah missed their night flight while Christine made theirs, _ slept in the airport.	Sarah	Christine	Sarah	agree	If X missed their flight, and Y made theirs, X sleeps in the airport.
Christine knew that Kayla didn't like roses, so _ asked for none in the bouquet.	Christine	Kayla	Christine	agree	If X was organizing a gift for Y, X would avoid including the flower Y didn't want.
The red skirt was too short for Victoria but fine for Amy because _ is very tall.	Victoria	Amy	Victoria	agree	If X is statuesque they can't wear things that aren't long like Y might.
To solve the problem, she threw the ball into the hole as the _ was immovable.	ball	hole	hole	agree	If X is immovable but Y is not, Y will be thrown
The best friends were writing letters to each other. Christine wrote in pen and Betty wrote in pencil so _ received a letter in ink.	Christine	Betty	Betty	agree	If X writes in Pen and Y writes in pencil then Y would receive a letter in pen from X.
The teens of Rachel are better behaved than the ones Mary has because _ is more laid back.	Rachel	Mary	Mary	agree	If X is more laid back than Y then Y's kids will be better behaved.
There were more ants under the carport than in the yard because it was wetter in the _ .	yard	carport	yard	agree	If ants like it wet, and X is wetter than Y, then the ants will prefer X.
Robert wanted carpeting on the floor and Eric didn't because _ knew that vacuuming was easier than sweeping.	Robert	Eric	Robert	agree	If X knows and Y doesn't X will install it.
The old woman tried to use the glasses to read the writings but the _ were too small.	writings	glasses	writings	agree	If X is very small, it might still be too small to read, even with Y.
When she went to the party, Louise had both  wine and crackers, because the _ made her hungry.	wine	crackers	wine	agree	If X makes somebody hungry then they will want Y.
The woman raised her eyebrows, because between a bike and car, the _ was going faster.	bike	car	bike	agree	If X should be faster than Y, and Y is going faster than X, it will raise eyebrows.
It was necessary to hit the iron with the sledgehammer before the _ got heated.	iron	sledgehammer	sledgehammer	agree	If X was heated it would be damaged by hitting Y.
Laura found a book and a magazine on the table, and she decided to take the _ because she was going to the beach for a short time.	book	magazine	magazine	agree	If X is shorter than Y, then X would be chosen to take for a short time..
When she went to the party, Louise had both  wine and crackers, because the _ made her thirsty.	wine	crackers	crackers	agree	If X makes you thirsty, than it's important to drink Y while eating X.
Mary was prone to depression while Monica was not, because _ was a naturally pessimistic person.	Mary	Monica	Monica	disagree	If X is a naturally pessimistic person, then X will be prone to depression while Y is not.
My back hurt more than my stomach did because my breasts weren't supported by the _ .	back	stomach	stomach	agree	If X doesn't support something but Y does then X will hurt more than Y.
James tried to put his hand in the glove but it keeps sliding off because the _ is small.	glove	hand	hand	agree	If X is too small then Y will slide off it.
The ability to finish what you start is what you need to improve, said Michael to Brian,  _ sometimes has to be the one to take charge.	Michael	Brian	Brian	disagree	If X sometimes has to be the one to take charge, then X will tell Y to improve.
Kenneth worked a lot more than Lawrence so it was always harder for _ to fall asleep.	Kenneth	Lawrence	Lawrence	agree	If X works harder than Y, X will be more tired.
Jen soldered wires to her circuit board using a soldering iron, and she had to hold the _ delicately.	wires	iron	wires	agree	If X is much thinner than Y, then someone has to hold X delicately.
Elena liked mayo on their sandwich but Victoria preferred mustard, so _ asked for Dukes on their turkey hoagie.	Elena	Victoria	Elena	agree	If X likes Mayo, and Y like mustard, then X will ask for Dukes.
Neil was not keen to go on a date with a guy but Nelson was because _ was homosexual.	Neil	Nelson	Neil	disagree	If X is homosexual, and Y isn't, then X is more likely to want to go on a date with a guy.
Amy paid for the new tattoo that Victoria was getting due to _ forgetting a Birthday gift.	Amy	Victoria	Amy	agree	If X forgot about the special day for Y, X will treat them.
Gem needed to heal her broken heart so she bought both ice cream and chocolate. She chose to eat the _ first because she was hot.	ice cream	chocolate	ice cream	agree	If you eat X it will help cool you more than Y because it's cold.
James wanted a Rolex but could only afford a plastic watch, and he was disappointed in the price of the _ .	plastic watch	Rolex	Rolex	agree	If you can't afford X you can likely afford Y.
The senator introduced legislation to raise taxes on the rich and lower them on the poor, since the _ already paid low taxes.	rich	poor	rich	agree	If X already pays less than Y, then X should pay more with new legislation.
The cat jumped from the couch to the wall but it slid down the wall because the _ is rough.	wall	couch	couch	agree	If a clawed animal lands on X it will slide but if it lands on Y it won't.
I could get my dental work done immediately or wait a few weeks. The _ approach will hurt my mouth.	immediately	wait	wait	agree	If the work is done in X time pain will continue but if I do it in Y I can solve it and get rid of pain.
Katrina really liked working at her company and Jessica needed a job, so _ impressed in an interview.	Katrina	Jessica	Jessica	agree	If X really needs a job in Y's company, then she will try to impress the interviewer.
Samuel shied away from the tough conversations that Kevin embraced, because _ had a more assertive personality.	Samuel	Kevin	Samuel	agree	If X is more assertive than Y, then X will embrace tough conversations while Y will shy away
