Monica thought that a foot was a real turn-on but Jessica thought they were gross. _ hated to suck on people's toes.	Monica	Jessica	Monica	disagree	If X thought a foot was a real turn-on, but Y thought they were gross, then Y would hate to suck on toes.
Ryan had never gone to a dealership and bought a car like Michael because _ never bought them from the owner.	Ryan	Michael	Michael	agree	If X doesn't buy direct, X uses the commercial spot more than Y would.
Rachel knew Elena needed more magnesium but _ didn't know if they hated fruit or not.	Rachel	Elena	Rachel	agree	If X knows Y needs more magnesium, then X doesn't necessarily know if they hate fruit or not.
There was less corn than beans left because the hogs hated eating the _ .	corn	beans	beans	agree	If X remains behind uneaten but Y is eaten the hogs didn't like it.
The tower sent a signal, but the radio still produced static, as the _ did not have the range to send a clean sound.	tower	radio	tower	agree	If X doesn't have the range to send a clean sound, then Y will have static.
Gem had the choice of eating crabs or visiting disney world parks in Florida. She chose the _ because she was full.	crabs	Parks	Parks	agree	If a person have a choice between X and Y, then the person will consider the situation and choose X.
Bailey took a pregnancy test and then went to a doctor's office, and the _ confirmed more quickly that she was pregnant.	pregnancy test	doctor's office	pregnancy test	agree	If X is faster than Y a person will use X over Y.
Brian needed to apply lotion more frequently than Adam due to _ 's naturally oily skin.	Brian	Adam	Adam	agree	If X has more oily skin than Y then X will need more lotion.
I went swimming with my towel and my float, and when the _ went in the pool, I was annoyed.	towel	float	towel	agree	If X goes in, it will sink, but Y won't.
Since there was only 1 piece of bubblewrap left, the woman chose to wrap the ornament instead of the star because the _ was more sturdy.	ornament	star	star	agree	If X is less sturdier than Y, then X should be protected by the only available  protector.
Dennis was stuck with very thin hair while Adam's hair was thick and fluffy. _ felt a little guilty.	Dennis	Adam	Adam	agree	If X has better hair than Y, then X will feel guilty
The cat could not climb up through the wall so it used the pillar because the _ is rough.	wall	pillar	pillar	agree	If a cat needs to climb a rough surface, and X is rougher than Y, the cat will climb up X.
Felicia likes the air conditioning setting much lower than Christine because _ is always feeling hot.	Felicia	Christine	Felicia	agree	If X is always feeling hot, then X will like the air conditioning much lower than Y.
Monica thought that a foot was a real turn-on but Jessica thought they were gross. _ liked to suck on people's toes.	Monica	Jessica	Jessica	disagree	If X likes something and Y does then X will do that action over Y.
Jason got into a deep financial hole, unlike Joel, because _ managed their fortune well.	Jason	Joel	Jason	disagree	If X managed money better than Y, then Y is more likely to get into a financial hole.
Jill wanted to use less plastic by switching to paper or canvas grocery bags.  She went with the _ because they could be reused longer.	paper	canvas	canvas	agree	If X can be reused longer than Y, then X will be chosen
Kyle thought the dog was stinky while Leslie seemed to not mind because _ has a clogged nose.	Kyle	Leslie	Leslie	agree	If X's nose was clogged, and Y's wasn't, Y would be able to smell a stinky dog easier than X would.
Phillipe wanted to use a perfume but the nozzle was blocked because of dirt. Luckily he could remove the _ out of the bottle.	dirt	nozzle	nozzle	agree	If X is blocking Y then X needs to be removed.
His two biggest problems were his consumption of cookies and potatoes.  The _ were often crumbling.	cookies	potatoes	cookies	agree	If you drop X it is more easily damaged than Y.
Playing in the snow was fun for Betty but not Elena because _ grew up in the west coast.	Betty	Elena	Elena	agree	If X grew up on the west coast and Y didn't then Y would enjoy snow more than X.
Neil kept the oranges and shared grapes with William because _ liked fruit with skin to peel.	Neil	William	Neil	agree	If X likes an added step to eating they prefer Oranges more than Y does.
Kenneth had an older cell phone than Jason, so when their brother needed to look something up while shopping, he asked _ .	Kenneth	Jason	Jason	agree	If X has an older device X will want to use the one Y owns.
On his way to the interview, Max bought a nice tie to go along with his slacks, but he spilled food on his lap, causing the _ to get dirty.	tie	slacks	slacks	agree	If X is worn while eating and something falls in their lap X will get dirty while Y is more vertical and would avoid a mess.
The woman applied 2 layers of fabric to the board but only 1 layer of felt because the _ was thicker.	fabric	felt	felt	agree	If X is thicker than Y, than you would need fewer layers of X.
Megan had to brush their hair frequently, but Laura avoided brushing too much, because _ had curly hair.	Megan	Laura	Laura	agree	If X has kinky hair, brushing it often could damage it more than the hair of Y.
Logan liked to dress like a teenager even though they were the same age as Jason, so _ shopped at the adult stores.	Logan	Jason	Jason	disagree	If X is more mature than Y, then X will shop there.
Kevin lives in Maine, and Matthew lives in Texas, so _ lives south of the Mason-Dixon line.	Kevin	Matthew	Matthew	agree	If X lives in the former confederacy, they live below Y.
Samuel suffered from constipation but Randy did not, so _ liked to drink a lot of orange juice.	Samuel	Randy	Randy	disagree	If X has digestion issues and Y doesn't then X will drink things to help them and Y won't.
Benjamin used dish soap for an emergency load of laundry while William used water, and so _ had spotted clothes.	Benjamin	William	William	agree	If X uses soap to clean something and Y uses water, then Y will not clean it better than X.
The wizards awarded Rebecca for Lindsey's achievements after _ was unfairly given credit for causing the victory.	Rebecca	Lindsey	Rebecca	agree	If X caused the victory, then giving credit to Y is unfair.
Patricia didn't help Carrie comfort the crying baby because _ has many children of her own.	Patricia	Carrie	Carrie	disagree	If X has many children they can't help Y with theirs.
Jason made it to puberty a few months before Christopher, so _ spoke with a deeper voice.	Jason	Christopher	Jason	agree	If X matures first their voice will reach a lower pitch earlier than Y.
The cook could safely touch the pot, but had to wait on the pan, because the _ was cold.	pot	pan	pot	agree	If X isn't cold, X isn't safe to touch
Eric loved to have friends over and entertain them but Donald didn't. _ threw dinner parties once a month.	Eric	Donald	Eric	agree	If X threw dinner parties, then X loved to have friends over and entertain, but Y did not.
Samantha wanted to buy Angela a dog because _ loved to take care of them.	Samantha	Angela	Samantha	disagree	If X purchased a gift for Y then it's something Y will enjoy.
John wanted to tie a rope around a tire to swing on but the _ was too soft.	tire	rope	tire	disagree	If X is heavy, then Y should be more durable and strong.
Erica needed a mortgage for her new home, but the _ she wanted was too expensive.	mortgage	home	home	agree	If you get an X you need a Y to buy it.
Megan hated the table she saw, but Emily loved it. When they left the store empty-handed, _ was disappointed.	Megan	Emily	Emily	agree	If X hated the table, but Y loved it, the Y would be disappointed leaving empty handed.
Sarah wanted to upgrade her style, she bought new clothes but kept the same shoes. The _ were trendy.	shoes	clothes	shoes	agree	If X is trendier than Y, Y will kbe replaced while X will not
It was ironic that Victoria mocked Laura for being fat, since it was _ who was the slender one.	Victoria	Laura	Laura	agree	If X is giving Y a hard time about something, it's worth noting that X is even worse in that aspect.
Rachel was forced to take baby steps when getting to know Elena, because _ had a fear of intimacy.	Rachel	Elena	Elena	agree	If X has a fear of intimacy, then Y needed to be slow in approaching X.
The scar needed medical care to heal, while the cut healed naturally, because the _ was a minor wound.	cut	scar	scar	disagree	If X is a minor wound and Y is not, then Y will need medical care.
Carrie wanted Sarah to get a new phone for _ believed anything not the latest update unacceptable.	Carrie	Sarah	Carrie	agree	If X thinks only new things are acceptable then she would think Y should have new things.
The dog ran away from Leslie and stopped at Lawrence because _ had soap for the dog to take a bath.	Leslie	Lawrence	Leslie	agree	If X has soap for a bath, then the dog will run away from X and stop at Y.
Joel shredded the guitar solo while Hunter hammered on the piano, because _ was an excellent guitarist.	Joel	Hunter	Joel	agree	If X is doing well, they'll be said to be tearing it up in some way, while Y simply hammers.
Donald got an infection after the accident unlike Samuel, because _ didn't worry about the cut.	Donald	Samuel	Donald	agree	If X worries about a cut and Y doesn't, they Y will get an infection.
Samantha helped Rachel study for her high school exams because _ is a good student.	Samantha	Rachel	Rachel	disagree	If X is a good student, the X will help Y study for exams.
I brought out the playing cards and tarot cards, we wanted to have a prediction so I took the _ and shuffled.	tarot cards	playing cards	tarot cards	agree	If you use X someone might try to predict something, much more accurately than is Y.
Sarah had to authorize the purchase for Jessica, because _ was still a teenager under the age of 18.	Sarah	Jessica	Sarah	disagree	If X is over 18, and Y isn't, then X would need to authorize purchases for Y.
The nails of Tanya were a lot dirtier than Natalie, by reason of _ being a lazy worker.	Tanya	Natalie	Natalie	agree	If X has uncared for nails they work harder than Y.
The estate was known to have the biggest bank in the region. The _ was very big.	Estate	Bank	Estate	disagree	If X is known to be bigger than Y then X would be very big.
Aaron had very prominent collarbones but not Jason because _ had a very skinny body.	Aaron	Jason	Aaron	agree	If X has low body fat, you can see their bones better than you can Y's.
A very single Christopher wanted Matthew's boyfriend, so _ broke them up by spreading rumors about them.	Christopher	Matthew	Christopher	agree	If X wanted Y they might spread rumors to break Y up.
Nick held Samuel's horse while they conditioned it, because _ was better with the cleaning.	Nick	Samuel	Samuel	agree	If Y is better with cleaning, the X will hold the horse while y conditions it.
Joel was the person who fed Craig's dog after dinner so _  got paid.	Joel	Craig	Craig	disagree	If X feeds the dog of Y, then X will get paid.
Lindsey had watery eyes but not Patricia because _ was storing onions in the kitchen.	Lindsey	Patricia	Patricia	agree	If X has an irritant they will suffer from that more than Y will.
The wall could prevent the waves from hitting the house, since the _ was behind it and the waves.	wall	house	house	agree	If X is in front then Y is protected.
They paid a lot for the bananas but were then given some apples for free because the _ were about to go bad.	apples	bananas	apples	agree	If X is going bad and Y isn't then X will be given away.
James was sad because his new ring do not enter his finger. He needed the _ to be smaller.	finger	ring	finger	agree	If he has a large X, Y won't fit.
Christine took baths much more regularly than Patricia because _ 's apartment only had a shower.	Christine	Patricia	Christine	disagree	If X took baths often they would have needed more than only a shower, which Y has.
The flower grew better in my house than in the yard because it was cooler in the _ .	yard	house	house	agree	If a flower needs cool air to grow, and X is cooler than Y, then the flower will grow better in X.
Nelson really loved yellow birds, while Craig really loved gray ones, which explains why _ kept so many pigeons.	Nelson	Craig	Craig	agree	If X loves yellow birds, while Y loves gray birds, Y will have more pigeons
The  was more careful unloading the eggs than the tomatoes into the house because the _ were tougher.	eggs	tomatoes	tomatoes	agree	If Y is tougher, then they will be more careful with X than with Y.
The pools had two water ranges of hot and cold. Due to the extreme temperatures in the winter, people chose the _ water.	cold	hot	hot	agree	If people prefer X over Y then people will choose X.
Joel needed William to get a contractor license for their company, so _ helped them fill out the paperwork.	Joel	William	Joel	agree	If X needs Y to get a license, X will help Y with the paperwork
Dennis surprised Steven with a watermelon as a snack because _ knew he loved them.	Dennis	Steven	Steven	disagree	If X knew Y loved them, then X will surprise Y with them.
Laura bought soil for their garden but not Tanya because _ had a square centimeter of land.	Laura	Tanya	Tanya	agree	If Y doesn't have a big land, then X will buy the soil instead of Y
During martial arts class the kid broke the blocks above the stones as the _ were being supported at his height.	blocks	stones	blocks	agree	If X is above Y, then X is being supported.
The two clothing items I love the most are my navy pencil skirt and black leather jacket. The _ is because it makes me look so professional.	skirt	jacket	skirt	agree	If X looks more professional than Y then X will be chosen.
Kim had to pack her bra and coat. Because it was spacious, she packed the _ .	bra	coat	coat	agree	If X is more spacious than Y then X will be packed.
They had invested in a large curtain that would drop onto the stage, but it didn’t work out because the _ was too low.	curtain	stage	stage	agree	If X is not high enough then Y won't reach.
Ash wanted to gain weight so when he saw vegetables and cookies, he piled the _ on his plate.	vegetables	cookies	cookies	agree	If you care about health you'll eat more X than Y.
Helen was curious about how the ball broke the window, because the _ was soft.	ball	window	ball	agree	If X is soft then it shouldn't be able to break Y.
The jar was made of glass but the bottle was plastic, so the _ was more durable.	jar	bottle	bottle	agree	If X is made of glass and Y is made of plastic, Y will be more durable
The camera Felicia bought was given a high rating on the internet blog Mary post on the internet, _ ads to the opinions of others .	Felicia	Mary	Mary	agree	If X read a good blog by Y on an item, then X would buy it.
Megan wore a white dress to the event, but not Lindsey, because _ knew that that it was inappropriate for a funeral.	Megan	Lindsey	Lindsey	agree	If Y knows it is inappropriate for a funeral, then Y will not wear a white dress while X will.
James realized that he cannot use pencil to write on the plate like he did on the board. The _ is rough.	plate	board	board	disagree	If X is rough and Y is not then it is easier to write on Y.
The woman could not find the emerald in the drawer because the _ was so large.	emerald	drawer	drawer	agree	If X is so large and Y is small, then it would be hard to find Y in it.
Randy blamed Neil for contracting salmonella poisoning because _ ate the Chicken Parmesan that was served.	Randy	Neil	Randy	agree	If X ate something and got sick but Y didn't, then X would blame Y for getting sick.
After stumbling back to the hotel room with a hangover, I spent the night hugging the toilet because the _ was perfect for sleeping it off.	toilet	hotel room	hotel room	agree	If X is perfect for sleeping it off and Y isn't then X will be used.
Lindsey rigged the system in their favor to beat Victoria, because _ was never going to lose otherwise.	Lindsey	Victoria	Victoria	agree	If X cheated they thought Y might defeat them.
Kim was falsely accused of theft at the store and not the police station because the people at the _ saw no proof.	police station	store	police station	agree	If X doesn't have proof for Y, then the accusation from X won't hold up at Y.
Mary was prone to depression while Monica was not, because _ was a naturally optimistic person.	Mary	Monica	Mary	disagree	If X is more optimistic than Y, X will be less prone to depression.
Maria is a pretty good athlete but Felicia is an elite athlete. _ finished their mile run in 8 minutes.	Maria	Felicia	Maria	agree	If X is pretty good they could run a mile in 8 min., while Y could do it faster since they are elite since an average person runs a mile in 9 to 10 minutes.
Playing in the snow was fun for Betty but not Elena because _ grew up in the east coast.	Betty	Elena	Betty	agree	If X grew up in the east coast X is likely to enjoy snow.
The dye showed up on Maria's hair more than Megan's hair because _ had lighter hair.	Maria	Megan	Maria	agree	If X has less dark hair than Y then you'll be able to see the added color more starkly.
Jennifer would outgrow Sarah in a matter of a few months even though _ was younger.	Jennifer	Sarah	Jennifer	agree	If X is growing really fast, then X will outgrow Y although X is younger.
The bus was supposed to arrive at 7:45 but the concert featuring my favorite indie band was scheduled for 8:00; luckily the _ was late so I didn't miss anything.	bus	concert	concert	agree	If X was late then if Y was also late it would work out well.
Eric loved to have friends over and entertain them but Donald didn't. _ threw dinner parties once a year.	Eric	Donald	Donald	agree	If X likes to entertain more than Y, then Y will host dinner parties less often than X
The man skipped watering the plant and only watered the lawn because the _ was moist.	plant	lawn	plant	agree	If X was already moist, and  was not, Y would need to be watered, and not X.
We kept the bread in the box to help prevent mold and to keep it out of sight because the _ made the kitchen look dirty.	bread	mold	mold	disagree	If X made the kitchen look dirty, then X would be kept in a box to prevent Y.
Maria dislikes bananas while they are Monica's favorite snack.  _  likes oranges second best.	Maria	Monica	Monica	agree	If X likes bananas and Y doesn't, then X's second favorite fruit could be oranges.
Joel was the person who fed Craig's dog after dinner so  _ didn't have to.	Joel	Craig	Joel	agree	If X feeds the dog of Y, then Y will not have to.
The wind tried its best to knock over the tree during the last hurricane, but the _ was too week.	tree	wind	wind	agree	If X cannot knock over Y, then X is too weak
The lost dog wanted food and water but there was a dumpster with _ , the dog ran past it.	water	food	food	agree	If something contains X but not Y, something will run past X and not Y.
Sunburn was a problem for Joseph but not for Donald because _ had very a very fair skin tone.	Joseph	Donald	Joseph	agree	If X's skin is fairer than Y's, X is more likely to get sunburned.
Unlike Craig, William avoided getting a cramp during the marathon, because _ stretched adequately beforehand.	Craig	William	Craig	disagree	If X stretches but Y does not, Y will get a cramp while X will not
Mary's apartment had a door in front and a kitchen window in back. When a fire broke out in the kitchen, Mary escaped through the _ .	door	window	door	agree	If a fire breaks out near X then you should go out Y.
Jim bought the phone instead of the monitor at the electronic store because the _ he had last was broken.	phone	monitor	phone	agree	If X is broken but Y is not, a new X will be purchased instead of a new Y
Jeffrey was tired of Brian calling him a pig at dinner, because _ told them to eat like a human being.	Jeffrey	Brian	Brian	agree	If X is eating like a pig and Y doesn't, then Y would tell X to eat like a human.
We were planning on growing cucumbers next to the tomatoes instead of the corn, since the _ were shorter.	corn	tomatoes	tomatoes	agree	If you grow X avoid planting it by Y so it doesn't overshadow it.
After her lips swelled up, Brian gave all the lip gloss to Christopher since _ was insensitive to it.	Brian	Christopher	Christopher	agree	If the irritant that bothered X was in the product but it didn't bother Y then Y should have it.
In order to transplant the flowers in his garden outside, Ted looked down at his shovel and his shears and picked up the _ .	shovel	shears	shovel	agree	If X is better for digging than Y, then if you have to transplant flowers, you should use X.
Classic game show Aaron invited a people over for dinner including Joseph, _ was surprised that know one showed up.	Aaron	Joseph	Aaron	agree	If X invites Y's over and Y's don't show then X would be surprised.
She was never able to use lash curlers on her lashes because the _ are too large.	lashes	curlers	curlers	agree	If X is too large compared to Y then people might not use X.
I'm annoyed my red sweater is clean and my green sweater isn't. The _ looks worse with this outfit.	green sweater	red sweater	red sweater	agree	If X would be a better choice than Y, it would be upsetting if X was dirty and not available.
Brett liked working for a big corporation but Neil preferred to work for a small business. _ got a job at Ben & Jerry's Ice Cream.	Brett	Neil	Brett	agree	If X likes working at a big corporation and Y doesn't, then X would take a job at a corporation.
Nick received the paint from Dennis to complete the project because _ was a better painter than him.	Nick	Dennis	Nick	agree	If X paints better then X gets it from Y so they can do the job.
We could see the strings of the guitar after it had got burnt because just the _ is inflammable.	string	guitar	string	agree	If X is inflammable, then even after burning, X would be visible.
Jeffrey asked Joel to express their feelings in a more productive manner, but _ was actually the one being petty.	Jeffrey	Joel	Jeffrey	agree	If X gives snide advice to Y then X is worse than Y.
The poodle was Monica's favorite dog breed while Betty loved German Shepherds. _ thought them too girly.	Monica	Betty	Betty	agree	If X likes something and Y doesn't then X will prefer something while Y will prefer something else.
The mom couldn't tell if the bumps were a rash or just irritation. If it was the _ she knew a bath would help.	rash	irritation	irritation	agree	If bumps are caused by X and not Y then a bath would sooth them.
It was months for the scopes to arrive, and only days for the boards, as the _ were shipped by boat.	scopes	boards	scopes	agree	If X comes from overseas on vessels it takes longer to arrive than Y.
Steven put off his jacket and gave it to Craig to put it on because _ is feeling colf.	Steven	Craig	Craig	agree	If X is cold and Y isn't then Y will give their jacket to X.
Victoria is has hired Laura to be the new person in charge of writing the Suday news article, _ manages works at a newspaper business.	Victoria	Laura	Victoria	agree	If X is a manager in a company, then they can hire Y as an employee.
Kayla was having trouble with Bedwetting but Victoria wasn't, so _ bought some silk sheets.	Kayla	Victoria	Victoria	agree	If Y is wetting the bed, they would not want silk sheets because they would ruin them, but since X is not wetting the bed, they can use silk sheets.
Although Victoria was much tidier than Elena was, _ let her clean the room anyway.	Victoria	Elena	Victoria	agree	If X isn't very neat, it would be notable if X cleaned the room of Y.
Amy wanted to set a coyote trap but Samantha insisted not to. _ was terrified with wild animals and wanted them gone.	Amy	Samantha	Amy	agree	If X wants something gone and Y doesn't then X will set traps and Y won't.
The cat could not climb up through the wall so it used the pillar because the _ is smooth.	wall	pillar	wall	agree	If a cat can't climb up a smooth surface, and X is smooth and Y is not, the cat would climb up Y.
Joel had to put on multiple layers of clothes unlike Logan because _ lived in a hot area.	Joel	Logan	Logan	agree	If X lives in a hotter area than Y, X would need fewer layers of clothes than Y.
I could get my dental work done immediately or wait a few weeks. The _ approach will hurt my budget.	immediately	wait	immediately	agree	If X is the time for your dental appointment and you have to pay prime prices for this it will cost more than Y, which you can call around and compare prices for.
As Maria was approaching Elena, she slowed and picked her steps carefully, as _ was always eager to surprise.	Maria	Elena	Maria	agree	If X is trying to sneak and surprise then they will move with caution when approaching Y.
Lawrence decided he must be a failure to Derrick since _ was the only one cheering.	Lawrence	Derrick	Lawrence	agree	If X is the only one cheering, the X must be a failure to Y.
The doctor put on plastic gloves to put the tube into the patient's stomach, so that the _ could be removed later.	tube	gloves	tube	agree	If X needs to be removed later then a doctor will use Y to remove X
Brett was going fishing, but Matthew hated earthworms, so _ let him bring fake worms.	Brett	Matthew	Brett	agree	If X hated worms then he would need the permission of Y who didn't hate them, to use them.
Derrick helped Jeffrey to remove rust off his bike frame using baking soda , because _ seems to be fun to ride with.	Derrick	Jeffrey	Jeffrey	agree	If X wants to ride bikes with Y, and Y has a problem with his bike, then X would want to help Y fix his bike.
John wore a sweater to play soccer but James wore a Tshirt because John thought the _ was cooler.	sweater	Tshirt	Tshirt	disagree	If John thought X was cooler, then John would wear X while James wears Y.
The woman applied 2 layers of fabric to the board but only 1 layer of felt because the _ was thinner.	fabric	felt	fabric	agree	If you use 1 tier of X you have to use 2 of Y.
